{
  "schema_version": "1.0.0",
  "artifact": {
    "id": "fixture_safe_batch_transform",
    "repository": "local://artifactfit-fixture",
    "commit": "fixture0001",
    "license_policy": {
      "allowed_spdx": [
        "MIT"
      ],
      "require_license_file": true,
      "allow_unknown": false
    },
    "official_entrypoints": [
      "programs/success.py"
    ],
    "declared_framework": "python"
  },
  "target": {
    "platform": "windows",
    "gpu_count": 0,
    "max_vram_gb": 0,
    "max_system_ram_gb": 1,
    "max_wall_time": 10,
    "max_workspace_growth_gb": 0.05,
    "max_download_gb": 0
  },
  "declared_invariants": {
    "task": "synthetic engineering safety fixture",
    "modalities": [
      "none"
    ],
    "model_family": "none",
    "backbone_constraints": [
      "unchanged"
    ],
    "input_constraints": [
      "unchanged"
    ],
    "dataset_semantics": "none",
    "evaluation_protocol": "process and cleanup predicates",
    "objective": "engineering feasibility only"
  },
  "transforms": {
    "allowed": [
      "training.batch_size",
      "runtime.num_workers",
      "runtime.output_dir"
    ],
    "review_required": [
      "model.gradient_checkpointing"
    ],
    "forbidden": [
      "model.backbone",
      "input.resolution",
      "input.modalities"
    ],
    "requested": [
      {
        "path": "training.batch_size",
        "original": 32,
        "proposed": 4
      }
    ]
  },
  "stages": {
    "P0": {
      "enabled": true,
      "command": [
        "artifactfit:internal"
      ],
      "expected_outputs": [],
      "timeout": 5,
      "success_predicates": [
        {
          "kind": "exit_code_zero"
        }
      ]
    },
    "P1": {
      "enabled": true,
      "command": [
        "artifactfit:internal"
      ],
      "expected_outputs": [],
      "timeout": 5,
      "success_predicates": [
        {
          "kind": "exit_code_zero"
        }
      ]
    },
    "P2": {
      "enabled": true,
      "command": [
        "python",
        "programs/success.py"
      ],
      "expected_outputs": [],
      "timeout": 5,
      "success_predicates": [
        {
          "kind": "exit_code_zero"
        }
      ],
      "working_directory": ".",
      "environment": {}
    }
  },
  "evidence": {
    "files_to_hash": [
      "README.md",
      "LICENSE",
      "output.txt"
    ],
    "environment_capture": true,
    "resource_trace": true,
    "stdout": true,
    "stderr": true
  },
  "runtime": {
    "network_allowed": false,
    "sample_interval_ms": 50,
    "stdout_limit_bytes": 65536,
    "stderr_limit_bytes": 65536,
    "require_clean_exit": true
  }
}
